{
  "$schema": "../../schema/registry-item.schema.json",
  "name": "hud-score-card",
  "type": "frogoe:block",
  "title": "Score Card",
  "description": "Big chunky score number with sticker depth and a bump animation on change; themeable via --hud-* custom properties",
  "tags": ["hud", "score", "number", "typography"],
  "files": [
    {
      "path": "hud-score-card.html",
      "target": "hud/score-card.html",
      "type": "frogoe:markup"
    }
  ],
  "bindings": ["data-hud-score"],
  "placement": "overlay",
  "preview": {
    "demo": "demo.html"
  }
}
