{
  "$schema": "../../schema/registry-item.schema.json",
  "name": "hud-mini-board",
  "type": "frogoe:block",
  "title": "Mini Board",
  "description": "Top-3 leaderboard chip with organic seed numbers, player-row highlight, and a fresh-best pop; themeable via --hud-*",
  "tags": ["hud", "leaderboard", "scores", "social-proof"],
  "files": [
    { "path": "hud-mini-board.html", "target": "hud/mini-board.html", "type": "frogoe:markup" }
  ],
  "bindings": ["data-hud-board", "data-hud-board-you"],
  "placement": "overlay",
  "preview": { "demo": "demo.html" }
}
