{
  "$schema": "../../schema/registry-item.schema.json",
  "name": "hud-ready-hint",
  "type": "frogoe:block",
  "title": "Ready Hint",
  "description": "The living-ready-state verb affordance: breathing giant instruction that hides the instant play starts; replaces start menus",
  "tags": ["hud", "ready", "affordance", "onboarding"],
  "files": [
    { "path": "hud-ready-hint.html", "target": "hud/ready-hint.html", "type": "frogoe:markup" }
  ],
  "bindings": ["data-hud-ready", "data-hud-verb", "data-hud-sub"],
  "placement": "overlay",
  "preview": { "demo": "demo.html" }
}
