{
  "$schema": "../../schema/registry-item.schema.json",
  "name": "hud-keyboard",
  "type": "frogoe:block",
  "title": "On-Screen Keyboard",
  "description": "Touch keyboard for the type verb \u2014 presses dispatch real KeyboardEvents through the frogoe contract (input.on(\"key\") and input.keys hear them like hardware); themeable via --block-* custom properties",
  "tags": [
    "hud",
    "keyboard",
    "input",
    "type",
    "word"
  ],
  "files": [
    {
      "path": "hud-keyboard.html",
      "target": "blocks/hud-keyboard.html",
      "type": "frogoe:markup"
    }
  ],
  "bindings": [
    "data-block-keyboard",
    "data-block-key"
  ],
  "placement": "overlay-anchored",
  "preview": {
    "demo": "demo.html"
  }
}
