{
  "$schema": "../../schema/registry-item.schema.json",
  "name": "score-card",
  "type": "frogoe:block",
  "title": "Score Card",
  "description": "Big chunky score number with sticker depth and a bump animation on change; themeable via --block-* custom properties",
  "tags": [
    "hud",
    "score",
    "number",
    "typography"
  ],
  "files": [
    {
      "path": "score-card.html",
      "target": "blocks/score-card.html",
      "type": "frogoe:markup"
    }
  ],
  "bindings": [
    "data-block-score"
  ],
  "placement": "overlay",
  "preview": {
    "demo": "demo.html"
  },
  "pos": "top-left"
}
