{
  "$schema": "../../schema/registry-item.schema.json",
  "name": "hud-objective-chip",
  "type": "frogoe:block",
  "title": "Objective Chip",
  "description": "Corner chip for one watched resource (moves/balls/retries): big tabular number, label, data-low warning state; themeable via --hud-*",
  "tags": ["hud", "objective", "moves", "resource", "chip"],
  "files": [
    {
      "path": "hud-objective-chip.html",
      "target": "hud/objective-chip.html",
      "type": "frogoe:markup"
    }
  ],
  "bindings": ["data-hud-objective", "data-hud-objective-value"],
  "placement": "overlay",
  "preview": { "demo": "demo.html" }
}
