{
  "$schema": "../../schema/registry-item.schema.json",
  "name": "hud-timer-ring",
  "type": "frogoe:block",
  "title": "Timer Ring",
  "description": "Circular countdown dial with smooth drain and a pulsing data-low danger state; themeable via --hud-*",
  "tags": ["hud", "timer", "countdown", "ring"],
  "files": [
    { "path": "hud-timer-ring.html", "target": "hud/timer-ring.html", "type": "frogoe:markup" }
  ],
  "bindings": ["data-hud-timer", "data-hud-timer-label"],
  "placement": "overlay",
  "preview": { "demo": "demo.html" }
}
