{
  "$schema": "../../schema/registry-item.schema.json",
  "name": "hud-coin-counter",
  "type": "frogoe:block",
  "title": "Coin Counter",
  "description": "Machined coin icon + tabular count with a gain pop and coin spin; themeable via --hud-*",
  "tags": ["hud", "coins", "currency", "pickup"],
  "files": [
    { "path": "hud-coin-counter.html", "target": "hud/coin-counter.html", "type": "frogoe:markup" }
  ],
  "bindings": ["data-hud-coins"],
  "placement": "overlay",
  "preview": { "demo": "demo.html" }
}
