{
  "$schema": "../../schema/registry-item.schema.json",
  "name": "hud-hearts-row",
  "type": "frogoe:block",
  "title": "Hearts Row",
  "description": "Lives as a row of hearts (clip-path silhouettes); lost hearts ghost with a pop, reduced-motion safe; themeable via --hud-*",
  "tags": ["hud", "lives", "health", "hearts"],
  "files": [
    {
      "path": "hud-hearts-row.html",
      "target": "hud/hearts-row.html",
      "type": "frogoe:markup"
    }
  ],
  "bindings": ["data-hud-hearts"],
  "placement": "overlay",
  "preview": {
    "demo": "demo.html"
  }
}
